{
  "app": "0.1.0",
  "author": "Thomas Chisholm",
  "ccli": "18723",
  "copyright": "Public domain",
  "cues": [
    {
      "advanceAfterMs": null,
      "commands": [
        {
          "channel": 1,
          "cmd": "channel.write",
          "content": { "kind": "media", "loop": true, "ref": "sha256:55c84469c37e1e6a72a9b8938422cd6536b302b583a5c127241c8304246f3527" },
          "transition": { "ms": 1000, "ref": 2, "scope": "once" }
        },
        {
          "channel": 2,
          "cmd": "channel.write",
          "content": {
            "fields": { "body": "Great is Thy faithfulness,\nO God my Father" },
            "kind": "text"
          }
        }
      ],
      "label": "Verse 1",
      "note": "",
      "section": "Verse 1",
      "trigger": { "type": "go" },
      "uuid": "11aa0000-0000-4000-8000-000000000001"
    },
    {
      "advanceAfterMs": null,
      "commands": [
        {
          "channel": 2,
          "cmd": "channel.write",
          "content": {
            "fields": { "body": "There is no shadow\nof turning with Thee" },
            "kind": "text"
          }
        }
      ],
      "label": "Verse 1",
      "note": "",
      "section": "Verse 1",
      "trigger": { "type": "go" },
      "uuid": "22bb0000-0000-4000-8000-000000000002"
    }
  ],
  "kind": "list",
  "number": 42,
  "schema": 1,
  "timeline": null,
  "title": "Great Is Thy Faithfulness",
  "trackThrough": false,
  "uuid": "a9f00000-0000-4000-8000-00000000002a",
  "version": 16
}
